{
  "id": "TASK-106",
  "title": "Fast Entry Sheet — Expense, Income, Transfer, Split Receipt",
  "type": "Feature",
  "routine": "Feature",
  "objective": "Build the single-screen FastEntrySheet bottom sheet handling all transaction types: single expense, income, account transfer, and multi-line receipt split with real-time remainder calculation.",
  "status": "Pending",
  "priority": 60,
  "verification_regime": "Hybrid",
  "dependencies": ["TASK-103", "TASK-105"],
  "trace_to": {
    "requirements": ["FR-001", "FR-002", "FR-003", "FR-004", "FR-009", "UR-001", "UR-002", "UR-003", "UR-006"],
    "design_nodes": ["VIEW-001", "VIEW-002"]
  },
  "tdd_cycle": {
    "test_file": "app/src/test/java/com/familyfinance/ui/entry/FastEntryViewModelTest.kt",
    "implementation_file": "app/src/main/java/com/familyfinance/ui/entry/FastEntrySheet.kt",
    "verification_command": "./gradlew testDebugUnitTest"
  },
  "execution_steps": [
    "Run 'loom start TASK-106'",
    "Run 'loom context TASK-106'",
    "Create FastEntryViewModel with StateFlow of: type (INCOME/EXPENSE/TRANSFER), amount, account, category, date, note, receiver, project(optional), splitLines[]",
    "Implement real-time remainder = totalAmount - sum(splitLines.amounts)",
    "Build FastEntrySheet BottomSheet UI with type toggle, mandatory pickers (account, category), optional pickers (project), and split line list",
    "Implement 'Add Split' button to dynamically add a split line (category + amount)",
    "On Save for single transaction: call SaveTransactionUseCase (validate category+account not null)",
    "On Save for split receipt: call SaveSplitReceiptUseCase (validate sum <= total)",
    "On Save for transfer: show second account picker, call SaveTransferUseCase (validate distinct accounts)",
    "Write ViewModel unit tests: remainder calculation, validation rejection (missing category, sum > total, same account transfer)",
    "Manual check: enter 100, add split 80 Food + 20 Consumables, verify remainder = 0, save, check timeline",
    "Run ./gradlew testDebugUnitTest",
    "Run 'loom complete TASK-106'"
  ],
  "definition_of_done": [
    "Saving expense without Category or Account is rejected",
    "Remainder auto-calculates in real-time",
    "Saving split where sum > total is rejected",
    "Saving transfer with same source/destination is rejected",
    "ViewModel unit tests pass",
    "All saved rows appear in Timeline immediately"
  ],
  "context": {
    "relevant_files": [
      ".spec/data/04_system/fr_001_record_expense.json",
      ".spec/data/04_system/fr_002_record_income.json",
      ".spec/data/04_system/fr_003_split_receipt.json",
      ".spec/data/04_system/fr_004_transfer.json",
      ".spec/data/06_execution/scn_001_record_expense.json",
      ".spec/data/06_execution/scn_003_split_receipt.json",
      ".spec/data/06_execution/scn_004_transfer.json",
      ".spec/data/05_design/view_002_process.json"
    ]
  }
}
